{
  "adapter_id": "irata__html_paginated",
  "version": "1.0.0",
  "output_contract_version": "2.1",
  "applies_to": {
    "url_pattern": "^https://irata\\.org/members.*"
  },
  "list": {
    "container": {
      "primary": {
        "strategy": "css",
        "value": "div.member-results"
      },
      "fallback_policy": "required",
      "fallback_1": {
        "strategy": "css",
        "value": "main"
      },
      "fallback_2": {
        "strategy": "xpath",
        "value": "//div[@id='content']"
      }
    },
    "row": {
      "primary": {
        "strategy": "css",
        "value": "article.member-card"
      },
      "fallback_policy": "required",
      "fallback_1": {
        "strategy": "css",
        "value": "div.member"
      },
      "fallback_2": {
        "strategy": "xpath",
        "value": ".//article"
      }
    },
    "empty_is_valid": false,
    "structural_count": {
      "primary": {
        "strategy": "css",
        "value": "article.member-card"
      },
      "fallback_policy": "none_with_reason",
      "fallback_reason": "single authoritative locator; drift must be explicit",
      "count_mode": "nodes"
    },
    "published_count": {
      "primary": {
        "strategy": "css_text",
        "value": "span.result-count"
      },
      "fallback_policy": "none_with_reason",
      "fallback_reason": "single authoritative locator; drift must be explicit",
      "count_mode": "value"
    }
  },
  "fields": {
    "published_name": {
      "selector": {
        "primary": {
          "strategy": "css_text",
          "value": "h3.member-name"
        },
        "fallback_policy": "required",
        "fallback_1": {
          "strategy": "role_text",
          "value": "heading"
        },
        "fallback_2": {
          "strategy": "xpath",
          "value": ".//h3|.//h2"
        }
      },
      "required": true,
      "normalize": "trim"
    },
    "published_country": {
      "selector": {
        "primary": {
          "strategy": "css_text",
          "value": "span.member-country"
        },
        "fallback_policy": "none_with_reason",
        "fallback_reason": "single authoritative locator; drift must be explicit"
      },
      "normalize": "country_iso2"
    },
    "published_locality": {
      "selector": {
        "primary": {
          "strategy": "css_text",
          "value": "span.member-city"
        },
        "fallback_policy": "none_with_reason",
        "fallback_reason": "single authoritative locator; drift must be explicit"
      },
      "normalize": "trim"
    },
    "published_address": {
      "selector": {
        "primary": {
          "strategy": "css_text",
          "value": "p.member-address"
        },
        "fallback_policy": "none_with_reason",
        "fallback_reason": "single authoritative locator; drift must be explicit"
      },
      "normalize": "trim"
    },
    "published_phone": {
      "selector": {
        "primary": {
          "strategy": "css_text",
          "value": "span.member-tel"
        },
        "fallback_policy": "none_with_reason",
        "fallback_reason": "single authoritative locator; drift must be explicit"
      },
      "normalize": "phone_e164_or_verbatim",
      "cardinality": "many"
    },
    "published_website": {
      "selector": {
        "primary": {
          "strategy": "css_attr",
          "value": "a.member-site@href"
        },
        "fallback_policy": "none_with_reason",
        "fallback_reason": "single authoritative locator; drift must be explicit"
      },
      "normalize": "url_absolute"
    },
    "official_relationship_wording": {
      "selector": {
        "primary": {
          "strategy": "css_text",
          "value": "span.member-grade"
        },
        "fallback_policy": "none_with_reason",
        "fallback_reason": "single authoritative locator; drift must be explicit"
      },
      "normalize": "trim"
    },
    "certificate_name": {
      "selector": {
        "primary": {
          "strategy": "css_text",
          "value": "li.training-level"
        },
        "fallback_policy": "none_with_reason",
        "fallback_reason": "single authoritative locator; drift must be explicit"
      },
      "cardinality": "many",
      "normalize": "trim"
    }
  },
  "pagination": {
    "kind": "url_template",
    "url_template": "https://irata.org/members?page={page}",
    "max_pages": 50
  },
  "rejects": [
    {
      "when": "\\b(lapsed|resigned)\\b",
      "parse_state": "rejected_not_centre"
    }
  ],
  "fixtures": [
    "0000000000000000000000000000000000000000000000000000000000000000"
  ]
}
